{
  "allowed_context": [
    "project_metadata",
    "released_graph",
    "released_rtl",
    "public_validation_summary"
  ],
  "difficulty": "easy",
  "family": "verification_generation",
  "input_nodes": [
    "project:ot_sram_2p",
    "module:ot_sram_2p"
  ],
  "oracle": {
    "gold_release": "not_in_alpha",
    "kind": "graph_and_tool_contract",
    "required_checks": [
      "schema",
      "compile_if_code",
      "lint_if_code",
      "project_regression_if_patch"
    ]
  },
  "output_contract": {
    "format": "structured_json_or_systemverilog_as_requested",
    "must_cite_graph_node_ids": true,
    "must_not_modify_tests": true
  },
  "project_id": "ot_sram_2p",
  "prompt": "Generate a self-checking verification plan and synthesizable-interface testbench strategy for ot_sram_2p. It must exercise the obligation: independent dual-port access and define explicit failure checks.",
  "provenance": {
    "derivation": "deterministic-v0.1-template",
    "project_revision": "e75e30cfd65cf41e",
    "review_status": "pending"
  },
  "quality": {
    "expert_reviewed": false,
    "mutation_validated": false,
    "tool_validated": false
  },
  "release_tier": "public",
  "schema_version": "ip-task/v1",
  "split": "train",
  "target_nodes": [
    "module:ot_sram_2p"
  ],
  "task_id": "ipgraph:ot_sram_2p:verification_generation:0000"
}
