{
  "allowed_context": [
    "project_metadata",
    "released_graph",
    "released_rtl",
    "public_validation_summary"
  ],
  "difficulty": "easy",
  "family": "verification_generation",
  "input_nodes": [
    "project:pid_controller",
    "module:pid_controller"
  ],
  "oracle": {
    "gold_release": "not_in_alpha",
    "kind": "graph_and_tool_contract",
    "required_checks": [
      "schema",
      "compile_if_code",
      "lint_if_code",
      "project_regression_if_patch"
    ]
  },
  "output_contract": {
    "format": "structured_json_or_systemverilog_as_requested",
    "must_cite_graph_node_ids": true,
    "must_not_modify_tests": true
  },
  "project_id": "pid_controller",
  "prompt": "Generate a self-checking verification plan and synthesizable-interface testbench strategy for pid_controller. It must exercise the obligation: Wishbone register access and define explicit failure checks.",
  "provenance": {
    "derivation": "deterministic-v0.1-template",
    "project_revision": "de6aef362242980a",
    "review_status": "pending"
  },
  "quality": {
    "expert_reviewed": false,
    "mutation_validated": false,
    "tool_validated": false
  },
  "release_tier": "public",
  "schema_version": "ip-task/v1",
  "split": "train",
  "target_nodes": [
    "module:pid_controller"
  ],
  "task_id": "ipgraph:pid_controller:verification_generation:0000"
}
