{
  "allowed_context": [
    "project_metadata",
    "released_graph",
    "released_rtl",
    "public_validation_summary"
  ],
  "difficulty": "medium",
  "family": "hierarchy_dependency_analysis",
  "input_nodes": [
    "project:i2c",
    "module:i2c_master_bit_ctrl",
    "module:i2c_master_byte_ctrl",
    "module:i2c_master_top"
  ],
  "oracle": {
    "gold_release": "not_in_alpha",
    "kind": "graph_and_tool_contract",
    "required_checks": [
      "schema",
      "compile_if_code",
      "lint_if_code",
      "project_regression_if_patch"
    ]
  },
  "output_contract": {
    "format": "structured_json_or_systemverilog_as_requested",
    "must_cite_graph_node_ids": true,
    "must_not_modify_tests": true
  },
  "project_id": "i2c",
  "prompt": "Recover and explain the module dependency and instantiation hierarchy of i2c, including the roles of i2c_master_bit_ctrl, i2c_master_byte_ctrl, i2c_master_top. Identify graph evidence for each dependency.",
  "provenance": {
    "derivation": "deterministic-v0.1-template",
    "project_revision": "56836dcd13c6c722",
    "review_status": "pending"
  },
  "quality": {
    "expert_reviewed": false,
    "mutation_validated": false,
    "tool_validated": false
  },
  "release_tier": "public",
  "schema_version": "ip-task/v1",
  "split": "train",
  "target_nodes": [
    "module:i2c_master_bit_ctrl",
    "module:i2c_master_byte_ctrl",
    "module:i2c_master_top"
  ],
  "task_id": "ipgraph:i2c:hierarchy_dependency_analysis:0000"
}
