{
  "allowed_context": [
    "project_metadata",
    "released_graph",
    "released_rtl",
    "public_validation_summary"
  ],
  "difficulty": "medium",
  "family": "hierarchical_rtl_generation",
  "input_nodes": [
    "project:dma_axi64",
    "module:dma_axi64",
    "module:dma_axi64_apb_mux",
    "module:dma_axi64_core0",
    "module:dma_axi64_core0_arbiter",
    "module:dma_axi64_core0_axim_cmd",
    "module:dma_axi64_core0_axim_rd",
    "module:dma_axi64_core0_axim_rdata",
    "module:dma_axi64_core0_axim_resp",
    "module:dma_axi64_core0_axim_timeout",
    "module:dma_axi64_core0_axim_wdata",
    "module:dma_axi64_core0_axim_wr",
    "module:dma_axi64_core0_ch"
  ],
  "oracle": {
    "gold_release": "not_in_alpha",
    "kind": "graph_and_tool_contract",
    "required_checks": [
      "schema",
      "compile_if_code",
      "lint_if_code",
      "project_regression_if_patch"
    ]
  },
  "output_contract": {
    "format": "structured_json_or_systemverilog_as_requested",
    "must_cite_graph_node_ids": true,
    "must_not_modify_tests": true
  },
  "project_id": "dma_axi64",
  "prompt": "Generate or complete synthesizable SystemVerilog for dma_axi64 from its released design contracts. Preserve the hierarchy and interfaces of dma_axi64, dma_axi64_apb_mux, dma_axi64_core0, dma_axi64_core0_arbiter, dma_axi64_core0_axim_cmd, dma_axi64_core0_axim_rd, dma_axi64_core0_axim_rdata, dma_axi64_core0_axim_resp, dma_axi64_core0_axim_timeout, dma_axi64_core0_axim_wdata, dma_axi64_core0_axim_wr, dma_axi64_core0_ch, reuse existing modules, and require the project regression as the oracle.",
  "provenance": {
    "derivation": "deterministic-v0.1-template",
    "project_revision": "9e13f7d5c135c1f4",
    "review_status": "pending"
  },
  "quality": {
    "expert_reviewed": false,
    "mutation_validated": false,
    "tool_validated": false
  },
  "release_tier": "private_until_release",
  "schema_version": "ip-task/v1",
  "split": "frozen_test",
  "target_nodes": [
    "module:dma_axi64",
    "module:dma_axi64_apb_mux",
    "module:dma_axi64_core0",
    "module:dma_axi64_core0_arbiter",
    "module:dma_axi64_core0_axim_cmd",
    "module:dma_axi64_core0_axim_rd",
    "module:dma_axi64_core0_axim_rdata",
    "module:dma_axi64_core0_axim_resp",
    "module:dma_axi64_core0_axim_timeout",
    "module:dma_axi64_core0_axim_wdata",
    "module:dma_axi64_core0_axim_wr",
    "module:dma_axi64_core0_ch"
  ],
  "task_id": "ipgraph:dma_axi64:hierarchical_rtl_generation:0000"
}
