{
  "allowed_context": [
    "project_metadata",
    "released_graph",
    "released_rtl",
    "public_validation_summary"
  ],
  "difficulty": "hard",
  "family": "hierarchical_integration",
  "input_nodes": [
    "project:apbtoaes128",
    "module:aes_core",
    "module:aes_ip",
    "module:control_unit",
    "module:data_swap",
    "module:datapath",
    "module:host_interface",
    "module:key_expander",
    "module:mix_columns",
    "module:sBox",
    "module:sBox_8",
    "module:shift_rows"
  ],
  "oracle": {
    "gold_release": "not_in_alpha",
    "kind": "graph_and_tool_contract",
    "required_checks": [
      "schema",
      "compile_if_code",
      "lint_if_code",
      "project_regression_if_patch"
    ]
  },
  "output_contract": {
    "format": "structured_json_or_systemverilog_as_requested",
    "must_cite_graph_node_ids": true,
    "must_not_modify_tests": true
  },
  "project_id": "apbtoaes128",
  "prompt": "Create a DesignGraph integration plan for apbtoaes128 that reuses its existing hierarchy instead of flattening or rewriting it. Include compile order and per-module verification obligations.",
  "provenance": {
    "derivation": "deterministic-v0.1-template",
    "project_revision": "f90705a281c58436",
    "review_status": "pending"
  },
  "quality": {
    "expert_reviewed": false,
    "mutation_validated": false,
    "tool_validated": false
  },
  "release_tier": "public",
  "schema_version": "ip-task/v1",
  "split": "train",
  "target_nodes": [
    "module:aes_core",
    "module:aes_ip",
    "module:control_unit",
    "module:data_swap",
    "module:datapath",
    "module:host_interface",
    "module:key_expander",
    "module:mix_columns",
    "module:sBox",
    "module:sBox_8",
    "module:shift_rows"
  ],
  "task_id": "ipgraph:apbtoaes128:hierarchical_integration:0001"
}
