{
  "allowed_context": [
    "project_metadata",
    "released_graph",
    "released_rtl",
    "public_validation_summary"
  ],
  "difficulty": "easy",
  "family": "hierarchical_rtl_generation",
  "input_nodes": [
    "project:cdc_ufifo",
    "module:cdc_ufifo"
  ],
  "oracle": {
    "gold_release": "not_in_alpha",
    "kind": "graph_and_tool_contract",
    "required_checks": [
      "schema",
      "compile_if_code",
      "lint_if_code",
      "project_regression_if_patch"
    ]
  },
  "output_contract": {
    "format": "structured_json_or_systemverilog_as_requested",
    "must_cite_graph_node_ids": true,
    "must_not_modify_tests": true
  },
  "project_id": "cdc_ufifo",
  "prompt": "Generate or complete synthesizable SystemVerilog for cdc_ufifo from its released design contracts. Preserve the hierarchy and interfaces of cdc_ufifo, reuse existing modules, and require the project regression as the oracle.",
  "provenance": {
    "derivation": "deterministic-v0.1-template",
    "project_revision": "105cbddd2bda2b7d",
    "review_status": "pending"
  },
  "quality": {
    "expert_reviewed": false,
    "mutation_validated": false,
    "tool_validated": false
  },
  "release_tier": "public",
  "schema_version": "ip-task/v1",
  "split": "train",
  "target_nodes": [
    "module:cdc_ufifo"
  ],
  "task_id": "ipgraph:cdc_ufifo:hierarchical_rtl_generation:0000"
}
