{
  "allowed_context": [
    "project_metadata",
    "released_graph",
    "released_rtl",
    "public_validation_summary"
  ],
  "difficulty": "medium",
  "family": "interface_modification",
  "input_nodes": [
    "project:pipelined_fft_64",
    "module:BUFRAM64C1",
    "module:CNORM",
    "module:FFT8",
    "module:MPU707",
    "module:RAM2x64C_1",
    "module:RAM64",
    "module:ROTATOR64",
    "module:USFFT64_2B",
    "module:WROM64"
  ],
  "oracle": {
    "gold_release": "not_in_alpha",
    "kind": "graph_and_tool_contract",
    "required_checks": [
      "schema",
      "compile_if_code",
      "lint_if_code",
      "project_regression_if_patch"
    ]
  },
  "output_contract": {
    "format": "structured_json_or_systemverilog_as_requested",
    "must_cite_graph_node_ids": true,
    "must_not_modify_tests": true
  },
  "project_id": "pipelined_fft_64",
  "prompt": "Plan a cross-module interface modification for pipelined_fft_64. Enumerate every affected module, instance, port, connection, test, and regression obligation before proposing edits.",
  "provenance": {
    "derivation": "deterministic-v0.1-template",
    "project_revision": "0bd86faa2703a2d8",
    "review_status": "pending"
  },
  "quality": {
    "expert_reviewed": false,
    "mutation_validated": false,
    "tool_validated": false
  },
  "release_tier": "public",
  "schema_version": "ip-task/v1",
  "split": "dev",
  "target_nodes": [
    "module:BUFRAM64C1",
    "module:CNORM",
    "module:FFT8",
    "module:MPU707",
    "module:RAM2x64C_1",
    "module:RAM64",
    "module:ROTATOR64",
    "module:USFFT64_2B",
    "module:WROM64"
  ],
  "task_id": "ipgraph:pipelined_fft_64:interface_modification:0001"
}
