{
  "allowed_context": [
    "project_metadata",
    "released_graph",
    "released_rtl",
    "public_validation_summary"
  ],
  "difficulty": "hard",
  "family": "hierarchical_integration",
  "input_nodes": [
    "project:pit",
    "module:pit_count",
    "module:pit_prescale",
    "module:pit_regs",
    "module:pit_top",
    "module:pit_wb_bus"
  ],
  "oracle": {
    "gold_release": "not_in_alpha",
    "kind": "graph_and_tool_contract",
    "required_checks": [
      "schema",
      "compile_if_code",
      "lint_if_code",
      "project_regression_if_patch"
    ]
  },
  "output_contract": {
    "format": "structured_json_or_systemverilog_as_requested",
    "must_cite_graph_node_ids": true,
    "must_not_modify_tests": true
  },
  "project_id": "pit",
  "prompt": "Create a DesignGraph integration plan for pit that reuses its existing hierarchy instead of flattening or rewriting it. Include compile order and per-module verification obligations.",
  "provenance": {
    "derivation": "deterministic-v0.1-template",
    "project_revision": "ef4068ee86dc4174",
    "review_status": "pending"
  },
  "quality": {
    "expert_reviewed": false,
    "mutation_validated": false,
    "tool_validated": false
  },
  "release_tier": "public",
  "schema_version": "ip-task/v1",
  "split": "train",
  "target_nodes": [
    "module:pit_count",
    "module:pit_prescale",
    "module:pit_regs",
    "module:pit_top",
    "module:pit_wb_bus"
  ],
  "task_id": "ipgraph:pit:hierarchical_integration:0000"
}
