{
  "allowed_context": [
    "project_metadata",
    "released_graph",
    "released_rtl",
    "public_validation_summary"
  ],
  "difficulty": "hard",
  "family": "cross_module_repair",
  "input_nodes": [
    "project:dma_axi64",
    "module:dma_axi64",
    "module:dma_axi64_apb_mux",
    "module:dma_axi64_core0",
    "module:dma_axi64_core0_arbiter",
    "module:dma_axi64_core0_axim_cmd",
    "module:dma_axi64_core0_axim_rd",
    "module:dma_axi64_core0_axim_rdata",
    "module:dma_axi64_core0_axim_resp",
    "module:dma_axi64_core0_axim_timeout",
    "module:dma_axi64_core0_axim_wdata",
    "module:dma_axi64_core0_axim_wr",
    "module:dma_axi64_core0_ch"
  ],
  "oracle": {
    "gold_release": "not_in_alpha",
    "kind": "graph_and_tool_contract",
    "required_checks": [
      "schema",
      "compile_if_code",
      "lint_if_code",
      "project_regression_if_patch"
    ]
  },
  "output_contract": {
    "format": "structured_json_or_systemverilog_as_requested",
    "must_cite_graph_node_ids": true,
    "must_not_modify_tests": true
  },
  "project_id": "dma_axi64",
  "prompt": "Localize and repair a hypothetical cross-module protocol failure in dma_axi64. Restrict modifications to the fault module and direct adapter, and require the complete project regression after the patch.",
  "provenance": {
    "derivation": "deterministic-v0.1-template",
    "project_revision": "9e13f7d5c135c1f4",
    "review_status": "pending"
  },
  "quality": {
    "expert_reviewed": false,
    "mutation_validated": false,
    "tool_validated": false
  },
  "release_tier": "private_until_release",
  "schema_version": "ip-task/v1",
  "split": "frozen_test",
  "target_nodes": [
    "module:dma_axi64",
    "module:dma_axi64_apb_mux",
    "module:dma_axi64_core0",
    "module:dma_axi64_core0_arbiter",
    "module:dma_axi64_core0_axim_cmd",
    "module:dma_axi64_core0_axim_rd",
    "module:dma_axi64_core0_axim_rdata",
    "module:dma_axi64_core0_axim_resp",
    "module:dma_axi64_core0_axim_timeout",
    "module:dma_axi64_core0_axim_wdata",
    "module:dma_axi64_core0_axim_wr",
    "module:dma_axi64_core0_ch"
  ],
  "task_id": "ipgraph:dma_axi64:cross_module_repair:0001"
}
