{
  "allowed_context": [
    "project_metadata",
    "released_graph",
    "released_rtl",
    "public_validation_summary"
  ],
  "difficulty": "medium",
  "family": "verification_generation",
  "input_nodes": [
    "project:sha_core",
    "module:sha1",
    "module:sha256",
    "module:sha512"
  ],
  "oracle": {
    "gold_release": "not_in_alpha",
    "kind": "graph_and_tool_contract",
    "required_checks": [
      "schema",
      "compile_if_code",
      "lint_if_code",
      "project_regression_if_patch"
    ]
  },
  "output_contract": {
    "format": "structured_json_or_systemverilog_as_requested",
    "must_cite_graph_node_ids": true,
    "must_not_modify_tests": true
  },
  "project_id": "sha_core",
  "prompt": "Generate a self-checking verification plan and synthesizable-interface testbench strategy for sha_core. It must exercise the obligation: SHA-1 known digest: 5 words and define explicit failure checks.",
  "provenance": {
    "derivation": "deterministic-v0.1-template",
    "project_revision": "820141491d22fd9e",
    "review_status": "pending"
  },
  "quality": {
    "expert_reviewed": false,
    "mutation_validated": false,
    "tool_validated": false
  },
  "release_tier": "public",
  "schema_version": "ip-task/v1",
  "split": "dev",
  "target_nodes": [
    "module:sha1",
    "module:sha256",
    "module:sha512"
  ],
  "task_id": "ipgraph:sha_core:verification_generation:0000"
}
