{
  "allowed_context": [
    "project_metadata",
    "released_graph",
    "released_rtl",
    "public_validation_summary"
  ],
  "difficulty": "medium",
  "family": "interface_modification",
  "input_nodes": [
    "project:binary_to_bcd",
    "module:bcd_to_binary",
    "module:binary_to_bcd"
  ],
  "oracle": {
    "gold_release": "not_in_alpha",
    "kind": "graph_and_tool_contract",
    "required_checks": [
      "schema",
      "compile_if_code",
      "lint_if_code",
      "project_regression_if_patch"
    ]
  },
  "output_contract": {
    "format": "structured_json_or_systemverilog_as_requested",
    "must_cite_graph_node_ids": true,
    "must_not_modify_tests": true
  },
  "project_id": "binary_to_bcd",
  "prompt": "Plan a cross-module interface modification for binary_to_bcd. Enumerate every affected module, instance, port, connection, test, and regression obligation before proposing edits.",
  "provenance": {
    "derivation": "deterministic-v0.1-template",
    "project_revision": "b158c502f7422dd7",
    "review_status": "pending"
  },
  "quality": {
    "expert_reviewed": false,
    "mutation_validated": false,
    "tool_validated": false
  },
  "release_tier": "public",
  "schema_version": "ip-task/v1",
  "split": "train",
  "target_nodes": [
    "module:bcd_to_binary",
    "module:binary_to_bcd"
  ],
  "task_id": "ipgraph:binary_to_bcd:interface_modification:0000"
}
