{
  "allowed_context": [
    "project_metadata",
    "released_graph",
    "released_rtl",
    "public_validation_summary"
  ],
  "difficulty": "easy",
  "family": "fault_localization_repair",
  "input_nodes": [
    "project:fir_filter",
    "module:fir_filter"
  ],
  "oracle": {
    "gold_release": "not_in_alpha",
    "kind": "graph_and_tool_contract",
    "required_checks": [
      "schema",
      "compile_if_code",
      "lint_if_code",
      "project_regression_if_patch"
    ]
  },
  "output_contract": {
    "format": "structured_json_or_systemverilog_as_requested",
    "must_cite_graph_node_ids": true,
    "must_not_modify_tests": true
  },
  "project_id": "fir_filter",
  "prompt": "Given a future failing regression for fir_filter, rank likely fault modules from graph evidence, request the minimum missing diagnostic evidence, and propose a constrained patch protocol that preserves all existing regressions.",
  "provenance": {
    "derivation": "deterministic-v0.1-template",
    "project_revision": "e6dddfe6a4a0d274",
    "review_status": "pending"
  },
  "quality": {
    "expert_reviewed": false,
    "mutation_validated": false,
    "tool_validated": false
  },
  "release_tier": "public",
  "schema_version": "ip-task/v1",
  "split": "public_test",
  "target_nodes": [
    "module:fir_filter"
  ],
  "task_id": "ipgraph:fir_filter:fault_localization_repair:0000"
}
