{
  "allowed_context": [
    "project_metadata",
    "released_graph",
    "released_rtl",
    "public_validation_summary"
  ],
  "difficulty": "easy",
  "family": "functional_timing_understanding",
  "input_nodes": [
    "project:oc_axi_bfm",
    "module:new_component"
  ],
  "oracle": {
    "gold_release": "not_in_alpha",
    "kind": "graph_and_tool_contract",
    "required_checks": [
      "schema",
      "compile_if_code",
      "lint_if_code",
      "project_regression_if_patch"
    ]
  },
  "output_contract": {
    "format": "structured_json_or_systemverilog_as_requested",
    "must_cite_graph_node_ids": true,
    "must_not_modify_tests": true
  },
  "project_id": "oc_axi_bfm",
  "prompt": "Explain the synthesizable function, state evolution, latency, clock/reset behavior, and externally visible protocol of oc_axi_bfm. Ground every claim in the provided graph and permitted artifacts.",
  "provenance": {
    "derivation": "deterministic-v0.1-template",
    "project_revision": "c6857cfad167d07c",
    "review_status": "pending"
  },
  "quality": {
    "expert_reviewed": false,
    "mutation_validated": false,
    "tool_validated": false
  },
  "release_tier": "private_until_release",
  "schema_version": "ip-task/v1",
  "split": "frozen_test",
  "target_nodes": [
    "module:new_component"
  ],
  "task_id": "ipgraph:oc_axi_bfm:functional_timing_understanding:0000"
}
